"Iniciativa Ciudadana para la Promoción de la Cultura del Diálogo A. C.","no","N/A","http://www.iniciativaciudadana.org.mx/biblioteca-digital.html","N/A","Sitio Web","Abierto","N/A","Otros","2010","Español","CEDUA","Demografía","N/A","México ; Emigración e inmigración ; Política migratoria ; Democracia","Espacio plural que fomenta el diálogo, la reflexión y los acuerdos en torno a las agendas públicas nacional y global, para consolidar la democracia en el país. Su biblioteca digital reúne libros, revistas y reportes en texto completo relacionados con temas de migración y políticas públicas.","N/A","0000-00-00","N/A","N/A","N/A","N/A","N/A","N/A","N/A","N/A"
"Institut National d'Etudes Démographiques.","no","N/A","http://www.ined.fr/en/homepage_of_ined_website/","N/A","Base de Datos  , Sitio Web","Parcialmente Abierto","N/A","Otros","N/A","Francés","CEDUA","Demografía","N/A","Población ; Demografía ; Europa ; Francia ; Investigación demográfica ; Emigración e inmigración ; Mortalidad ; Estadísticas vitales","Enfocado en Europa y Francia, también incluye documentos relacionados con otras regiones. El sitio permite acceso a sus investigaciones recientes, recursos y documentos, gráficos y un apartado llamado |Todo sobre población|. Al acceder a su base de datos INEDOC es posible descargar documentos en texto completo.","N/A","0000-00-00","N/A","N/A","N/A","N/A","N/A","N/A","N/A","N/A"
"Institute for Economics and Peace","no","N/A","http://economicsandpeace.org/","N/A","Sitio Web","Abierto","N/A","Otros","2016-00-00","Inglés","CEE  , CEI  , CES","Ciencia Política  , Economía","N/A","Paz - Costos, Violencia - Costos, Terrorismo - Costos","|The Institute for Economics and Peace is the world’s leading think tank dedicated to developing metrics to analyse peace and to quantify its economic value. It does this by developing global and national indices, calculating the economic cost of violence, analysing country level risk and understanding positive peace.

The research is used extensively by governments, academic institutions, think tanks, non-governmental organisations and by intergovernmental institutions such as the OECD, The Commonwealth Secretariat, the World Bank and the United Nations. The Institute was recently ranked in the top 15 most impactful think tanks in the world on the Global Go To Think Tank Index.

Founded by IT entrepreneur and philanthropist Steve Killelea (see full bio) in 2007, the Institute for Economics and Peace is impacting traditional thinking on matters of security, defence, terrorism and development.|","N/A","2016-02-11","N/A","N/A","N/A","N/A","N/A","N/A","N/A","N/A"
"Institute for Research on Women, Gender, and Sexuality","no","N/A","http://irwgs.columbia.edu/","N/A","Sitio Web","Abierto","N/A","Otros","N/A","Inglés","PIEM","Estudios de Género","N/A","Estudios de género -- investigación","Presenta la oferta académica y de investigación que ofrece la universidad en la especialidad de Estudios de Género","N/A","2015-12-15","N/A","N/A","N/A","N/A","N/A","N/A","N/A","N/A"
"Institute for Women’s Studies in the Arab World","no","N/A","http://iwsaw.lau.edu.lb/about/","N/A","Sitio Web","Abierto","N/A","Otros","N/A","Inglés","PIEM","Estudios de Género","N/A","Estudios de género","El instituto desarrolla investigación en torno a las condiciones de vida de las mujeres en Arabia, así como orientar en torno a los derechos de las mujeres en la región.","N/A","0000-00-00","N/A","N/A","N/A","N/A","N/A","N/A","N/A","N/A"
"Instituto Centroamericano de Administración Pública","no","N/A","http://www.icap.ac.cr/","N/A","Sitio Web","Abierto","N/A","Otros","N/A","Español","CEI","Administración Pública","N/A","Administración pública ; América del Sur ; Estadísticas","El Instituto Centroamericano de Administración Pública se presenta como un organismo internacional del Sistema de la Integración Centroamericana (SICA), de carácter intergubernamental, al servicio de la región centroamericana. En esta página se ofrecen documentos sobre administración pública en texto completo, convocatorias y reportes estadísticos de la región Centro y Sudamerica.","N/A","2014-10-22","N/A","N/A","N/A","N/A","N/A","N/A","N/A","N/A"
"Instituto Centroamericano de Estudios Fiscales","no","N/A","http://icefi.org/","N/A","Sitio Web","Abierto","N/A","Otros","2015-00-00","Español","CEE","Economía","N/A","Economía ; América Latina ; Finanzas","El ICEFI realiza investigación sobre cuestiones fiscales, contables, economía política, impuestos, gasto público y derechos humanos sobre la región centroamericana. Por medio de publicaciones oficiales, reportes técnicos e informes ejecutivos donde se puede acceder a la información anteriormente mencionada.","N/A","0000-00-00","N/A","N/A","N/A","N/A","N/A","N/A","N/A","N/A"
"Instituto de Administración Pública del Estado de México:","no","N/A","http://www.iapem.org.mx/index.php","N/A","Sitio Web","Abierto","N/A","Otros","N/A","Español","CEI","Administración Pública","N/A","Administración pública ; Estado de México (México) ; Asociaciones civiles","El Instituto de Administración Pública del Estado de México es una asociación civil, dotada de personalidad juridica y patrimonio propios que tiene como propósito promover el desarrollo integral de la Administración Pública y ciencias afines. El sitio contiene el acceso al texto completo de sus revistas y libros electrónicos en texto completo.","N/A","2014-10-22","N/A","N/A","N/A","N/A","N/A","N/A","N/A","N/A"
"Instituto de Investigaciones Históricas. UNAM","no","N/A","http://www.iih.unam.mx/","N/A","N/A","Abierto","N/A","Otros","2013-05-27","N/A","N/A","N/A","N/A","Historia ; Investigación","N/A","N/A","0000-00-00","N/A","N/A","N/A","N/A","N/A","N/A","N/A","N/A"
"Instituto de Investigaciones. Dr. José María Luis Mora","no","N/A","http://www.mora.edu.mx/inicio.aspx","N/A","N/A","Abierto","N/A","Otros","N/A","N/A","N/A","N/A","N/A","Historia ;  Investigación ; Centros de investigación","N/A","N/A","0000-00-00","N/A","N/A","N/A","N/A","N/A","N/A","N/A","N/A"
"Instituto Lingüístico de Verano (ILV) en México","no","N/A","http://www.sil.org/mexico/23e-Lenguas.htm","N/A","Sitio Web","Parcialmente Abierto","N/A","Otros","2012","Español  , Inglés","CELL","Lingüística","N/A","Lenguas indígenas ; México ; Mapas ; Lingüística","|Este sitio da acceso a información sobre las lenguas y culturas indígenas del México moderno|.","N/A","0000-00-00","N/A","N/A","N/A","N/A","N/A","N/A","N/A","N/A"
"Instituto Mexicano para la Competitividad A.C.","no","N/A","http://imco.org.mx/home/","N/A","Sitio Web","Abierto","N/A","Otros","2015-00-00","Español","CEDUA  , CEE  , CEI  , CES","Administración Pública  , Ciencia Política  , Demografía    , Economía   , Estudios Urbanos   , Medio Ambiente  , Relaciones Internacionales  , Sociología","N/A","Transparencia y rendición de cuentas;Eficiencia en el uso de los recursos públicos;Establecimiento de un Estado de Derecho;Seguridad;Sustentabilidad ambiental;Inclusión social;Educación de calidad;Desarrollo de mercados eficientes...","|El Instituto Mexicano para la Competitividad (IMCO) es un centro de investigación aplicada basada en evidencia. Nuestra misión institucional es ser consultores de la sociedad mexicana en materia de políticas públicas. Somos una institución independiente, apartidista y sin fines de lucro, dedicada a elaborar propuestas viables para mejorar la capacidad de México para atraer y retener talento e inversiones.

El IMCO se fundó en 2004 y desde entonces su trabajo se ha enfocado en generar análisis y propuestas de política pública con el fin de promover un debate informado en torno al desarrollo del país.|","N/A","2015-11-13","N/A","N/A","N/A","N/A","N/A","N/A","N/A","N/A"
"Instituto Nacional de Administración Pública:","no","N/A","http://www.inap.mx/portal/","N/A","Sitio Web","Abierto","N/A","Otros","N/A","Español","CEI","Administración Pública","N/A","Administración Pública ; Investigación ; Publicaciones oficiales","Ofrece información sobre la administración pública en México. Proporciona liga a todos los sitios de las Secretarias de Estado  y  a sitios del Poder Legislativo y Judicial. Remite a sitios web con información internacional sobre administración pública. Ofrece una revista digital en texto completo con temas de su interés.","N/A","2014-10-22","N/A","N/A","N/A","N/A","N/A","N/A","N/A","N/A"
"Instituto Nacional de Ecología y Cambio Climático: publicaciones","no","N/A","http://www2.ine.gob.mx/publicaciones/","N/A","Libro electrónico","Abierto","N/A","Instituto Nacional de Ecología","N/A","Español","CEDUA","Medio Ambiente","N/A","Ecología ; Medio ambiente ; Cambio clímatico global","N/A","N/A","0000-00-00","N/A","N/A","N/A","N/A","N/A","N/A","N/A","N/A"
"Instituto Nacional de Estadística y Geografía (INEGI)","si","N/A","http://www.inegi.org.mx/","N/A","Base de Datos","Abierto","N/A","Instituto Nacional de Estadística y Geografía (INEGI)","N/A","Español","CEDUA","Demografía    , Economía   , Estudios de Género  , Estudios Urbanos   , Medio Ambiente","N/A","México ; Demografía ; Población ; Economía ; Geografía ; Medio ambiente ; Estadísticas","N/A","N/A","0000-00-00","N/A","N/A","N/A","N/A","N/A","N/A","N/A","N/A"
"Instituto Nacional de Estudios Históricos de las Revoluciones de Mexico","no","N/A","http://www.inehrm.gob.mx/","N/A","Sitio Web","Abierto","N/A","Otros","N/A","Español","CEH","Historia","N/A","México ; Revolución mexicana ; Historia ; Investigación","N/A","N/A","0000-00-00","N/A","N/A","N/A","N/A","N/A","N/A","N/A","N/A"
"Instituto Nacional de Salud Pública: Publicaciones","no","N/A","http://www.insp.mx/produccion-editorial/novedades-editoriales.html","N/A","Sitio Web","Abierto","N/A","Otros","2015","Español","CEDUA","Demografía","N/A","Salud pública ; Salud reproductiva ; Epidemiología","Las publicaciones del INSP difunden resultados de investigación en salud pública de alta calidad. La producción editorial abarca no sólo obras institucionales, sino también las que se generan a través de  proyectos conjuntos con instituciones nacionales e internacionales.","N/A","2016-02-16","N/A","N/A","N/A","N/A","N/A","N/A","N/A","N/A"
"Insula: Revista de Letras y Ciencias humanas","no","N/A","N/A","N/A","N/A","Sólo comunidad Colmex","N/A","Otros","N/A","N/A","N/A","N/A","N/A","Literatura ; Historia y crítica ;  Novela ;  Poesía ;  Teatro ;  Ensayo","Disponible en formato impreso: 1946-2013","N/A","0000-00-00","N/A","N/A","N/A","N/A","N/A","N/A","N/A","N/A"
"Inter Classica","no","N/A","http://interclassica.um.es/","N/A","Sitio Web","Abierto","N/A","Otros","2014","Español","CELL","Literatura","N/A","Literatura clásica","Su finalidad es divulgar contenidos a los ámbitos del mundo Griego y Romano antiguos.","N/A","0000-00-00","N/A","N/A","N/A","N/A","N/A","N/A","N/A","N/A"
"International  Labor and Working Class History","ambos","N/A","http://ejournals.ebsco.com/journal2.asp?journalid=108861","N/A","N/A","Sólo comunidad Colmex","N/A","Otros","N/A","N/A","N/A","N/A","N/A","Proletariado ; Sindicalismo ; Movimiento obrero ; Historia ; Revistas","Disponible en formato impreso: 1985, 1991-2011","N/A","0000-00-00","N/A","N/A","N/A","N/A","N/A","N/A","N/A","N/A"
"International Climate Initiative","no","N/A","https://www.international-climate-initiative.com/en/about-the-iki/","N/A","Sitio Web","Abierto","N/A","Otros","2014-02-00","Alemán  , Inglés","CEDUA","Medio Ambiente","N/A","Gases del efecto invernadero ; Deforestación ; Diversidad biológica ; Cambio climático","Sitio web que reúne información sobre mitigación de gases de efecto irvernadero, diversidad biológica y cambio climático, entre otros temas relacionados. Incluye libros en texto completo en formato PDF y vídeos sobre medio ambiente de diferentes países de América Latina incluido México.","N/A","2015-05-25","N/A","N/A","N/A","N/A","N/A","N/A","N/A","N/A"
"International Commission on Large Dams","no","N/A","http://www.icold-cigb.org/GB/Publications/others_publications.asp","N/A","Sitio Web","Parcialmente Abierto","N/A","Otros","2015-07-01","Inglés","CEDUA","Medio Ambiente","N/A","Presas ; Aspectos ambientales ; Aspectos sociales ; Ríos","Organización no-gubernamental que tiene el propósito de recopilar y difundir información sobre el diseño, construcción, seguridad e impacto ambiental. Reúne información sobre congresos, simposios y boletines, entre otros. Algunos reportes de investigación se pueden descargar en PDF libremente. Además, incluye un diccionario especializado sobre presas que contiene términos en español, francés, inglés, italiano, portugués, etc. México es miembro de esta organización.","N/A","2015-07-01","N/A","N/A","N/A","N/A","N/A","N/A","N/A","N/A"
"International Conference on Burma/Myanmar Studies","no","N/A","http://rcsd.soc.cmu.ac.th/web/Burma/docmedia.php?type=1","N/A","Sitio Web","Abierto","N/A","Otros","N/A","Inglés","CEAA","Artes  , Historia  , Relaciones Internacionales","N/A","Myanmar ; Congresos, conferencias, etc.","Sitio con información de la Conferencia Internacional sobre estudios de Birmania/Myanmar. Contiene el registro a la conferencia del año, el formato, los temas, el contacto y en general, los requisitos de participación a la conferencia. Incluye las los documentos (proceedings) sobre conferencias anteriores en texto completo en formato pdf. Los  documentos van desde textos hasta presentaciones en powerpoint.","N/A","2015-11-06","N/A","N/A","N/A","N/A","N/A","N/A","N/A","N/A"
"International encyclopedia of public policy and administration","si","N/A","N/A","N/A","Obra de referencia","Sólo comunidad Colmex","N/A","Otros","1998","Inglés","CEI","Administración Pública","N/A","Administración pública ; Políticas públicas ; Enciclopedias y diccionarios","Recurso disponible en formato impreso en: International encyclopedia of public policy and administration / editor in chief Jay M. Shafritz -- Boulder, Colo., Westview, 1998.  Clasificación: REF/350.3 / In61","N/A","0000-00-00","N/A","N/A","N/A","N/A","N/A","N/A","N/A","N/A"
"International Development Research Centre","no","N/A","http://www.idrc.ca","N/A","Sitio Web","Parcialmente Abierto","N/A","Otros","2014--00--0","Inglés","CES","Economía   , Medio Ambiente  , Sociología","N/A","Pobreza ; Salud ;  Innovaciones técnicas ;  Medio ambiente","|The International Development Research Centre (IDRC) is a Canadian Crown corporation established by an act of Parliament in 1970 to help developing countries find solutions to their problems.

We encourage and support researchers and innovators in those countries to find practical, long-term solutions to the social, economic, and environmental problems their societies face. Our goal is to find ways to reduce poverty, improve health, support innovation, and safeguard the environment.

We often work with other Canadian government departments and agencies on programs of mutual interest that are aligned with Canadian values and government priorities. Many of these initiatives create opportunities for researchers from Canada and the developing world to collaborate on research of common interest|","N/A","2014-11-10","N/A","N/A","N/A","N/A","N/A","N/A","N/A","N/A"
"International Family Planning Perspectives","si","N/A","http://www.jstor.org/action/showPublication?journalCode=intefamiplanper2","N/A","N/A","Sólo comunidad Colmex","N/A","Otros","N/A","N/A","N/A","N/A","N/A","Control de la natalidad ; Familia ; Salud reproductiva ; Investigación","International Family Planning Perspectives (1979-2008) cambió de título a International Perspectives on Sexual & Reproductive Health.
Publica las últimas investigaciones revisadas por pares sobre políticas relevantes y análisis sobre salud y derechos sexuales y reproductivos en Estados  Unidos, Asia, África y América Latina.","N/A","0000-00-00","N/A","N/A","N/A","N/A","N/A","N/A","N/A","N/A"
"International Institute for Sustainable Development.","si","N/A","http://www.iisd.org/publications","N/A","Sitio Web","Abierto","N/A","Otros","2014","Inglés","CEDUA","Medio Ambiente","N/A","Cambios climáticos ; Cambio ambiental globa l;  Desarrollo sostenible ; Recursos energéticos renovables ; Agua ; Investigación","La base de datos de las Publicaciones del IISD incluye libros, videos, documentos y otros materiales que capturan gran parte de la historia institucional y la investigación del IISD. Casi todas las publicaciones de IISD están disponibles en formato PDF gratis.","N/A","0000-00-00","N/A","N/A","N/A","N/A","N/A","N/A","N/A","N/A"
"International Journal of American Linguistics","ambos","N/A","http://ehis.ebscohost.com/ehost/detail?sid=59234c1f-f635-41ad-af0b-087a4cd38027%40sessionmgr13&vid=1&hid=16&bdata=Jmxhbmc9ZXMmc2l0ZT1laG9zdC1saXZl#db=a9h&jid=IAL","N/A","N/A","Sólo comunidad Colmex","N/A","Otros","N/A","N/A","N/A","N/A","N/A","Lingüística ;  Lenguaje y lenguas","Disponible en formato impreso: 1917-2011","N/A","0000-00-00","N/A","N/A","N/A","N/A","N/A","N/A","N/A","N/A"
"International journal of business science and applied management","no","N/A","http://www.business-and-management.org/index.php","N/A","Publicación periódica","Abierto","N/A","Otros","2015-00-00","Inglés","CEE","Economía","N/A","Economía ; Economía comparada ; Administración ; Finanzas","Revista que publica artículos sobre economía internacional y comparada. cuenta con un  comité de arbitraje internacional que editan documentos sobre comercio electrónico, e-gobierno, estrategias económicas y financieras y estudia el rol de organizaciones internacionales en los temas de su competencia.","N/A","0000-00-00","N/A","N/A","N/A","N/A","N/A","N/A","N/A","N/A"
"International journal of industrial organization","si","N/A","http://www.sciencedirect.com/science/journal/01677187","N/A","N/A","Sólo comunidad Colmex","N/A","Otros","N/A","N/A","N/A","N/A","N/A","Economía ; Organización industrial ; Política industrial","En formato impreso 1983-1995, 1999-2009","N/A","2014-03-04","N/A","N/A","N/A","N/A","N/A","N/A","N/A","N/A"
"International Journal of Korean History","si","N/A","N/A","N/A","N/A","Sólo comunidad Colmex","N/A","Otros","N/A","N/A","N/A","N/A","N/A","Corea ;  Historia ; Cultura ; Sociedad","Recurso impreso en:  International journal of Korean history.  Seoul: Korea University, Institute of Korean Culture, Center for Korean History, 2000-.  v. : il. ; 23 cm. (951.9005 / In6127). El sitio electrónico en inglés y coreano, sin texto completo.","N/A","0000-00-00","N/A","N/A","N/A","N/A","N/A","N/A","N/A","N/A"
"International Journal of Lexicography","si","N/A","N/A","N/A","N/A","Sólo comunidad Colmex","N/A","Otros","N/A","N/A","N/A","N/A","N/A","Lexicografía ; Investigación ; Revistas","Disponible en formato impreso: 1988-2013","N/A","0000-00-00","N/A","N/A","N/A","N/A","N/A","N/A","N/A","N/A"
"International Journal of Public Administration","si","N/A","http://ejournals.ebsco.com/Journal2.asp?JournalID=107838","N/A","N/A","Sólo comunidad Colmex","N/A","Otros","N/A","N/A","N/A","N/A","N/A","Administración pública ; Investigación ; Revistas","N/A","N/A","2014-03-04","N/A","N/A","N/A","N/A","N/A","N/A","N/A","N/A"
"International Journal of the Sociology of Language","ambos","N/A","http://ejournals.ebsco.com/Journal2.asp?JournalID=107626","N/A","N/A","Sólo comunidad Colmex","N/A","Otros","N/A","N/A","N/A","N/A","N/A","Sociolingüística ; Lenguaje y lenguas ; Estudio y enseñanza","Disponible en formato impreso: 1977-2011 (con algunos faltantes)","N/A","0000-00-00","N/A","N/A","N/A","N/A","N/A","N/A","N/A","N/A"
"International Journal of Urban and Regional Research","ambos","N/A","http://onlinelibrary.wiley.com/journal/10.1111/(ISSN)1468-2427","N/A","N/A","Sólo comunidad Colmex","N/A","Wiley","N/A","N/A","N/A","N/A","N/A","Planificación regional ; Urbanismo  ; Investigación","N/A","N/A","0000-00-00","N/A","N/A","N/A","N/A","N/A","N/A","N/A","N/A"
"International Medieval Bibliography","si","N/A","http://200.52.255.191/F/?func=find-b&request=470491&find_code=SYS&adjacent=N&x=0&y=0&filter_code_1=WLN&filter_request_1=&filter_code_2=WYR&filter_request_2=&filter_code_4=WFT&filter_request_4=&filter_code_3=WYR&filter_request_3=","N/A","N/A","Abierto","N/A","Otros","N/A","N/A","N/A","N/A","N/A","Historia medieval ; Bibliografía ; Revistas","Disponible en formato impreso: 1998-2001 (con algunos faltantes)","N/A","0000-00-00","N/A","N/A","N/A","N/A","N/A","N/A","N/A","N/A"
"International Migration","ambos","N/A","http://onlinelibrary.wiley.com/journal/10.1111/(ISSN)1468-2435/issues","N/A","N/A","Sólo comunidad Colmex","N/A","Otros","N/A","N/A","N/A","N/A","N/A","Emigración e inmigración ;  Política migratoria ; Investigación","Publicación de la  Organización Internacional para las Migraciones (OIM), aborda temas como Migración Transnacional, Mujeres y Migración, Tráfico de personas, entre otros.","N/A","0000-00-00","N/A","N/A","N/A","N/A","N/A","N/A","N/A","N/A"
"International Migration Review","ambos","N/A","http://www.jstor.org/journals/01979183.html","N/A","N/A","Sólo comunidad Colmex","N/A","Otros","N/A","N/A","N/A","N/A","N/A","Emigración e inmigración ;  Política migratoria ; Migración ; Aspectos sociales ; Investigación","Publicación cuatrimestral, arbitrada por pares, aborda temas socio-demográficos, económicos, históricos, políticos y aspectos legislativos sobre la migración humana y los movimientos de refugiados.","N/A","0000-00-00","N/A","N/A","N/A","N/A","N/A","N/A","N/A","N/A"
"International Monetary Fund (IMF) data and statistics","si","N/A","http://www.imf.org/external/data.htm","N/A","N/A","Abierto","N/A","Otros","N/A","N/A","N/A","N/A","N/A","Indicadores económicos ; Finanzas internacionales ; Estadísticas","N/A","N/A","0000-00-00","N/A","N/A","N/A","N/A","N/A","N/A","N/A","N/A"
"International Monetary Fund Statistics","no","N/A","http://elibrary-data.imf.org/DataExplorer.aspx","N/A","Base de Datos","Sólo comunidad Colmex","N/A","Otros","2014-00-00","Inglés","CEE","Economía","N/A","Economía ; Estadísticas ; Proyecciones económicas","Recurso de información estadística, el cual proporciona por medio de diferentes indicadores económicos y financieros acceso a gráficas e información sobre estos datos a nivel internacional. Se cuenta también con reportes técnicos y cuadernos de trabajo relacionados a economía internacional.","N/A","0000-00-00","N/A","N/A","N/A","N/A","N/A","N/A","N/A","N/A"
"International Organization","ambos","N/A","http://ejournals.ebsco.com/journal2.asp?journalid=109456","N/A","N/A","Abierto","N/A","Otros","N/A","N/A","N/A","N/A","N/A","Organización internacional ; Relaciones internacionales","N/A","N/A","0000-00-00","N/A","N/A","N/A","N/A","N/A","N/A","N/A","N/A"
"International Organization for Migration","no","N/A","http://publications.iom.int/","N/A","Libro electrónico  , Publicación periódica","Falta determinar","N/A","Otros","N/A","Español  , Francés  , Inglés","CEDUA","Demografía","N/A","Emigración e inmigración ; Migración de retorno ; Geografía de la población ; Migración interna ; Movilidad laboral ; Refugiados","OIM produce una gran variedad de publicaciones en el campo de la política y la investigación sobre la migración, la mayoría pueden descargarse de forma gratuita. Su catálogo incluye opciones de búsqueda avanzada y brinda información referencial de artículos, documentos, libros, entre otros, especializados en el tema.","N/A","2016-02-16","N/A","N/A","N/A","N/A","N/A","N/A","N/A","N/A"
"International political science abstracts","ambos","N/A","http://ejournals.ebsco.com/journal2.asp?journalid=715182","N/A","N/A","Sólo comunidad Colmex","N/A","Otros","2013","N/A","N/A","N/A","N/A","Política mundial ; Derecho internacional ; Resúmenes","N/A","N/A","0000-00-00","N/A","N/A","N/A","N/A","N/A","N/A","N/A","N/A"
"International Politics","no","N/A","https://link.springer.com/journal/41311","N/A","Publicación periódica","Sólo comunidad Colmex","N/A","Springer","N/A","Inglés","CEI","Relaciones Internacionales  , Ciencia Política","N/A","N/A","Es una revista pionera revisada por pares dedicada a la exploración de los asuntos trasnacionales y las problemáticas globales. Sin una postura política o metodológica específica, la revista agradece las contribuciones apropiadas que comunican los hallazgos y provocan un diálogo más profundo.","N/A","2018-11-09","N/A","N/A","N/A","N/A","N/A","N/A","N/A","N/A"
"International Regional Science Review","ambos","N/A","http://search.ebscohost.com/login.aspx?direct=true&db=a9h&jid=FMK〈=es&site=ehost-live","N/A","N/A","Sólo comunidad Colmex","N/A","Sage","2014","N/A","N/A","N/A","N/A","N/A","Planificación regional ; Ciencias sociales","N/A","0000-00-00","N/A","N/A","N/A","N/A","N/A","N/A","N/A","N/A"
"International relations : a political dictionary","si","N/A","N/A","N/A","Obra de referencia","Abierto","N/A","Otros","N/A","Inglés","CEI","Relaciones Internacionales","N/A","Relaciones internacionales ; Diccionarios","By..., Jack C. Plano and Roy Olton.  Santa Barbara, Calif.ABC-CLIOc1995 x, 458 p. : ilus. ; 26 cm.","N/A","0000-00-00","N/A","N/A","N/A","N/A","N/A","N/A","N/A","N/A"
"International relations dictionary","si","N/A","N/A","N/A","Obra de referencia","Abierto","N/A","Otros","N/A","Inglés","CEI","Relaciones Internacionales","N/A","Relaciones internacionales ; Enciclopedias y diccionarios","[Washington]1978 iii, 48 p. ; 27 cm","N/A","0000-00-00","N/A","N/A","N/A","N/A","N/A","N/A","N/A","N/A"
