"Phonology","ambos","N/A","http://ejournals.ebsco.com/Journal2.asp?JournalID=101830","N/A","N/A","Sólo comunidad Colmex","N/A","Otros","N/A","N/A","N/A","N/A","N/A","Fonología ; Lingüística ; Revistas","Disponible en formato impreso: 1984-2011 (con algunos faltantes)","N/A","0000-00-00","N/A","N/A","N/A","N/A","N/A","N/A","N/A","N/A"
"Place Branding and Public Diplomacy","no","N/A","https://link.springer.com/journal/41254","N/A","Publicación periódica","Sólo comunidad Colmex","N/A","Springer","N/A","Inglés","CEI","Relaciones Internacionales  , Ciencia Política","N/A","N/A","ofrece un vehículo para la discusión sobre las plazas de las marcas, una práctica en rápida expansión. La revista presenta una cobertura profunda y detallada y abarca las disciplinas que van desde las relaciones públicas a través de mercadotecnia de destino, hasta estrategia de marca, marca de exportación, política económica y cultural.","N/A","2018-11-09","N/A","N/A","N/A","N/A","N/A","N/A","N/A","N/A"
"Planeando tu vida [disco compacto]","si","N/A","N/A","N/A","Obra de referencia","Abierto","N/A","Otros","N/A","Español","PIEM  , CES","Sociología  , Estudios de Género","N/A","Estudios de la mujer","[México, D.F.] Instituto Nacional de las Mujeres: Secretaría de Salud, [2002] 1 disco compacto; 4 1/3 plg.","N/A","0000-00-00","N/A","N/A","N/A","N/A","N/A","N/A","N/A","N/A"
"Planes de Desarrollo urbano (Estado de México)","no","N/A","http://portal2.edomex.gob.mx/sedur/index.htm","N/A","Sitio Web","Falta determinar","N/A","Otros","2011","Español","CEDUA","Estudios Urbanos","N/A","Política urbana ; Planeación de la ciudad ; Uso de tierra urbana ; Casa y terrenos urbanos ; Estado de México","Portal de la Secretaría de Desarrollo Urbano del Gobierno del Estado de México, contiene los Planes de desarrollo urbano (Estatales, Municipales y Regionales); sobre Desarrollos habitacionales; Autorizaciones; y Uso de suelo hasta el 2011.","N/A","2015-11-12","N/A","N/A","N/A","N/A","N/A","N/A","N/A","N/A"
"Plano, Jack G..   Diccionario de relaciones internacionales","si","N/A","N/A","N/A","Obra de referencia","Abierto","N/A","Otros","N/A","Español","CEI","Relaciones Internacionales","N/A","Relaciones internacionales ; Obras de referencia","[por]... [y] Roy Olton [versión española de José Meza Nieto].  MéxicoLimusa-Wiley1971 465 p. ; 21 cm.","N/A","0000-00-00","N/A","N/A","N/A","N/A","N/A","N/A","N/A","N/A"
"Pluralidad y consenso","no","N/A","http://www.senado.gob.mx/ibd/content/revistas.php","N/A","Publicación periódica","Abierto","N/A","Otros","09-2015","Español","CEI","Ciencia Política  , Economía   , Sociología","N/A","México -- Política y gobierno;  América Latina -- Política y gobierno;","|La Revista Pluralidad y Consenso se publica trimestralmente, en versión digital así como en forma impresa. Abarca temas de política y sociedad, economía y finanzas, problemática internacional, y Estado y soberanía, entre otros asuntos de interés para el desarrollo nacional y el fomento de la cultura cívica y ciudadana.| Editada por el Instituto Belisario Domínguez (IBD) del Senado de la República de México.","N/A","0000-00-00","N/A","N/A","N/A","N/A","N/A","N/A","N/A","N/A"
"Población y Salud en Mesoamérica","no","N/A","http://ccp.ucr.ac.cr/revista/","N/A","N/A","Abierto","N/A","Otros","N/A","N/A","N/A","N/A","N/A","Población ; Desarrollo rural ; Salud pública","Población y Salud en Mesoamérica es una revista electrónica de carácter académico, publicada semestralmente por el Centro Centroamericano de Población (CCP) de la Universidad de Costa Rica. El objetivo primordial de esta publicación es la difusión de los resultados de investigaciones en población y salud. Esta revista se encuentra indexada y registrada en importantes índices internacionales","N/A","0000-00-00","N/A","N/A","N/A","N/A","N/A","N/A","N/A","N/A"
"Poetics","ambos","N/A","http://www.sciencedirect.com/science/journal/0304422X","N/A","N/A","Sólo comunidad Colmex","N/A","Otros","N/A","N/A","N/A","N/A","N/A","Literatura ; Lingüística ; Poesía ; Revistas","Disponible en formato impreso: 1973-2010","N/A","0000-00-00","N/A","N/A","N/A","N/A","N/A","N/A","N/A","N/A"
"Poetique","no","N/A","N/A","N/A","N/A","Abierto","N/A","Otros","N/A","N/A","N/A","N/A","N/A","Poesía ; Revistas","N/A","N/A","0000-00-00","N/A","N/A","N/A","N/A","N/A","N/A","N/A","N/A"
"Policy review","si","N/A","N/A","N/A","N/A","Abierto","N/A","Otros","N/A","N/A","N/A","N/A","N/A","Ciencia política ; Revistas","N/A","N/A","0000-00-00","N/A","N/A","N/A","N/A","N/A","N/A","N/A","N/A"
"Política exterior","si","N/A","N/A","N/A","N/A","Abierto","N/A","Otros","N/A","N/A","N/A","N/A","N/A","Ciencia política ; Revistas","N/A","N/A","0000-00-00","N/A","N/A","N/A","N/A","N/A","N/A","N/A","N/A"
"Political constraint index, The","no","N/A","http://www-management.wharton.upenn.edu/henisz/","N/A","Sitio Web","Abierto","N/A","Otros","N/A","Inglés","CEI  , CEE","Economía   , Ciencia Política","N/A","Economía política ; Ciencia política","N/A","N/A","0000-00-00","N/A","N/A","N/A","N/A","N/A","N/A","N/A","N/A"
"Political science  a SAGE full-text collection","no","N/A","http://online.sagepub.com/collection.dtl?coll=POLI","N/A","Base de Datos","Sólo comunidad Colmex","N/A","Sage","N/A","Inglés","CEI","Relaciones Internacionales  , Ciencia Política","N/A","Ciencia política ; Administración pública ; Bases de datos","Se trata de una compilación de las revistas que ofrece SAGE para las áreas de Ciencia política y Relaciones internacionales.","N/A","2014-10-20","N/A","N/A","N/A","N/A","N/A","N/A","N/A","N/A"
"Political Science Quarterly","ambos","N/A","http://onlinelibrary.wiley.com/journal/10.1002/%28ISSN%291538-165X/issues","N/A","N/A","Sólo comunidad Colmex","N/A","Otros","N/A","N/A","N/A","N/A","N/A","Ciencia política ; Revistas","Disponible en formato impreso:1886-2013","N/A","0000-00-00","N/A","N/A","N/A","N/A","N/A","N/A","N/A","N/A"
"Political Studies Association (UK)","no","N/A","http://www.psa.ac.uk/","N/A","Sitio Web","Abierto","N/A","Otros","N/A","Inglés","CEI","Ciencia Política","N/A","Ciencia política ; Relaciones internacionales","Fundado en 1950, su objetivo es desarrollar y promover el estudio de política. Es considerada la principal Asociación en su campo en el Reino Unido, con  membresía de carácter internacional que incluye académicos en ciencias políticas y temas de actualidad, teóricos y practicantes,  políticos, investigadores y estudiantes universitario.","N/A","2014-10-23","N/A","N/A","N/A","N/A","N/A","N/A","N/A","N/A"
"Politique internationale","si","N/A","N/A","N/A","N/A","Abierto","N/A","Otros","N/A","N/A","N/A","N/A","N/A","Ciencia política ; Revistas","N/A","N/A","0000-00-00","N/A","N/A","N/A","N/A","N/A","N/A","N/A","N/A"
"Popline","no","N/A","http://www.popline.org/","N/A","Base de Datos","Abierto","N/A","No Aplica","N/A","Inglés","PIEM  , CES  , CEDUA","Sociología  , Estudios de Género  , Demografía","N/A","Planificación familiar ; Salud reproductiva ; SIDA","Incluye información sobre la población, la planificación familiar y la salud reproductiva.","N/A","0000-00-00","N/A","N/A","N/A","N/A","N/A","N/A","N/A","N/A"
"Popol Vuh","no","N/A","http://www.literaturaguatemalteca.org/popol.html","N/A","Libro electrónico","Abierto","N/A","Otros","N/A","Español","CES  , CELL  , CEH","Sociología  , Religión  , Literatura  , Historia","N/A","Mayas ; Religión ; Mitología ; Quiché ; Popol vuh","Texto completo en formato html del |Popol vuh|, traducido por Adrian Recinos.","N/A","2014-11-06","N/A","N/A","N/A","N/A","N/A","N/A","N/A","N/A"
"Population (ed. francés)","ambos","N/A","http://www.jstor.org/action/showPublication?journalCode=popufrenedit","N/A","N/A","Sólo comunidad Colmex","N/A","Otros","N/A","N/A","N/A","N/A","N/A","Población ;  Desarrollo rural ; Revistas","La revue Population est intégralement publiée en français (Population-F) et en anglais (Population-E) depuis janvier 2002. Cette revue scientifique trimestrielle est soumise à un comité de rédaction composé de personnalités scientifiques. Elle accueille des travaux originaux de chercheurs en démographie et dans des disciplines associées : sociologie, économie, anthropologie, histoire, géographie, épidémiologie et santé publique, méthodologie en sciences sociales. 

Disponible en formato impreso: 1946 - 2007","N/A","0000-00-00","N/A","N/A","N/A","N/A","N/A","N/A","N/A","N/A"
"Population (ed. inglés)","ambos","N/A","http://www.jstor.org/action/showPublication?journalCode=popuengledit2002","N/A","N/A","Sólo comunidad Colmex","N/A","Otros","N/A","N/A","N/A","N/A","N/A","Población ; Desarrollo rural ; Revistas","Since January 2002, POPULATION has undergone a radical transformation: Each issue is now available in a full English edition (Population-E) as well as in its French edition (Population-F). POPULATION is a bimonthly scientific journal featuring original studies in the fields of demography and related disciplines: sociology, economy, anthropology, history, geography, epidemiology and public health, methodology in the social sciences. Contributions, which can be submitted in either English or French, are peer-reviewed by an Editorial Board and published in both languages. They cover both developed and developing countries. In addition, current population trends are studied in two annual reports: |The Demographic Situation in France| and |The Demography of the World's Regions: Situation and Trends|. A report on |The Demographic Situation of Europe and the Developed Countries| is published regularly.

Disponible en formato impreso: 2002-2013","N/A","0000-00-00","N/A","N/A","N/A","N/A","N/A","N/A","N/A","N/A"
"Population and Environment","ambos","N/A","http://link.springer.com/journal/volumesAndIssues/11111","N/A","N/A","Sólo comunidad Colmex","N/A","Otros","N/A","N/A","N/A","N/A","N/A","Población ; Medio ambiente","Population and Environment is the sole social science journal focused on interdisciplinary research on social demographic aspects of environmental issues. The journal publishes cutting-edge research that contributes new insights on the complex, reciprocal links between human populations and the natural environment. 

Disponible en formato impreso: 1988 - 2007","N/A","0000-00-00","N/A","N/A","N/A","N/A","N/A","N/A","N/A","N/A"
"Population Bulletin","ambos","N/A","http://www.prb.org/Publications.aspx","N/A","Publicación periódica","Abierto","N/A","Otros","N/A","Inglés","CEDUA","Demografía","N/A","Población ; Desarrollo rural ; Salud pública","PRB's Population Bulletins explore current domestic and international population issues and trends. Written for a general audience by noted experts, they present population topics in clear and objective text with colorful graphics. Bulletins are widely used in university classes and by the media.

Disponible en formato impreso: 1962 - 2013","N/A","0000-00-00","N/A","N/A","N/A","N/A","N/A","N/A","N/A","N/A"
"Population index on the web","no","N/A","http://popindex.princeton.edu/","N/A","Base de Datos  , Sitio Web","Abierto","N/A","No Aplica","N/A","Inglés","CEDUA","Medio Ambiente  , Estudios Urbanos   , Demografía","N/A","Población ; Investigación demográfica ; Indices","|Population Index| publicado entre 1937 y 1999, es una herramienta de referencia para la literatura sobre población mundial. Presenta una bibliografía comentada de libros, artículos, documentos de trabajo y otros materiales sobre temas de población. Ofrece una base de datos de búsqueda y exploración que contiene 46.035 resúmenes de la literatura demográfica publicados durante el período 1986-2000. La colección de revistas completa que se remonta a la década de 1930 está disponible en JSTOR.","N/A","0000-00-00","N/A","N/A","N/A","N/A","N/A","N/A","N/A","N/A"
"Population and Development Review","no","N/A","http://www.jstor.org/journals/00987921.html","N/A","N/A","Sólo comunidad Colmex","N/A","Otros","N/A","N/A","N/A","N/A","N/A","Población ;  Desarrollo rural ; Revistas","Founded in 1975, Population and Development Review seeks to advance knowledge of the interrelationships between population and socioeconomic development and provides a forum for discussion of related issues of public policy. Combining readability with scholarship, the journal draws on high-level social science expertise-in economics, anthropology, sociology, and political science-to offer challenging ideas, provocative analysis, and critical insights. Each issue includes a lively collection of book reviews and an archives section that brings to light historical writings with a resonance for contemporary population debate.

Disponible en formato impreso: 1975 - 2012","N/A","0000-00-00","N/A","N/A","N/A","N/A","N/A","N/A","N/A","N/A"
"Population of Japan","no","N/A","http://www.worldometers.info/world-population/japan-population/","N/A","Sitio Web","Abierto","N/A","Otros","N/A","Inglés","CEAA","Demografía","N/A","Japón ; Población ; Estadística","Página de Wolrdmeters con estadísticas mundiales. Presenta estadísticas de población de todos los países del mundo. En esta caso, de Japón. Contiene gráficas y estadísticas de la población de Japón, pronósticos al 2050, notas y definiciones. La página se actualiza diariamente.","N/A","2015-11-24","N/A","N/A","N/A","N/A","N/A","N/A","N/A","N/A"
"Population Studies: a Journal of Demography","ambos","N/A","http://www.jstor.org/action/showPublication?journalCode=popustud","N/A","N/A","Sólo comunidad Colmex","N/A","Otros","N/A","N/A","N/A","N/A","N/A","Población ; Investigación demográfica","Disponible en formato impreso: 1947 - 2008","N/A","0000-00-00","N/A","N/A","N/A","N/A","N/A","N/A","N/A","N/A"
"Portal de Archivos Españoles (PARES)","no","N/A","http://www.mcu.es/archivos/CE/PARES.html","N/A","Base de Datos  , Sitio Web","Abierto","N/A","Otros","N/A","Español","CEH","Historia","N/A","España ; Historia ; Archivos","El Portal de Archivos Españoles (PARES) es un proyecto del Ministerio de Educación, Cultura y Deporte destinado a la difusión en Internet del Patrimonio Histórico Documental Español conservado en su red de centros. Ofrece el acceso a bases de datos descriptivas de documentos y a bancos de imágenes digitalizadas de los mismos.","N/A","0000-00-00","N/A","N/A","N/A","N/A","N/A","N/A","N/A","N/A"
"Portal de economía global","no","si","http://cee.colmex.mx/eglobal/index.php/es/","N/A","Base de Datos","Abierto","N/A","Otros","2014-00-00","Francés  , Español  , Inglés","CEE  , CEH","Economía   , Historia","N/A","Economía ; Historia económica ; Indicadores financieros ; Economía internacional","Portal web desarrollado por iniciativa del Profesor Carlos Marichal, el cual reúne varios recursos de información económica y financiera. En el portal es posible encontrar indicadores financieros de diversas partes del mundo, páginas de los bancos centrales de América Latina, bolsas de valores, noticias, líneas del tiempo, diversas entidades financieras, ministerios de economía y una amplia gama de servicios de información y publicaciones oficiales en texto completo.","N/A","0000-00-00","N/A","N/A","N/A","N/A","N/A","N/A","N/A","N/A"
"Portal de economía solidaria","no","N/A","http://www.economiasolidaria.org/","N/A","Blog","Abierto","N/A","Otros","2016-00-00","Español","CEE","Economía","N/A","Economía ; Desarrollo económico ; Comercio justo","Portal de información relacionada con el comercio justo y la economía solidaria. En este recurso se  encuentran seleccionados recursos de información seleccionados por especialistas en el tema y es posible encontrar extractos de libros, libros completos, artículos, notas periodísticas, videos y comentarios de expertos. El portal se actualiza constantemente y cuenta con firmas de alto reconocimiento internacional.","N/A","0000-00-00","N/A","N/A","N/A","N/A","N/A","N/A","N/A","N/A"
"Portal de Hispanismo","no","N/A","http://hispanismo.cervantes.es/","N/A","Sitio Web","Abierto","N/A","Otros","N/A","Español","CELL","Traducción  , Literatura  , Lenguaje y Lenguas (Estudio y enseñanza)  , Lingüística","N/A","Hispanistas ; Literatura española","Proporciona información sobre los estudios hispánicos en el mundo. Contiene tres grandes rubros: hispanistas, departamentos de español y asociaciones. Además, proporciona información sobre eventos, tesis doctorales, redes de investigación, entre otros","N/A","0000-00-00","N/A","N/A","N/A","N/A","N/A","N/A","N/A","N/A"
"Portal de la Traducción  Ibérica y Americana","no","N/A","http://www.traduccionliteraria.org/","N/A","Sitio Web","Abierto","N/A","Universidad Autónoma de Barcelona","N/A","Español","CELL","Traducción  , Literatura  , Lingüística","N/A","Traducción e interpretación","|El portal incluye diversas publicaciones y proyectos en formato digital, y reúne distintas líneas de investigación: historia de la traducción; literatura comparada; interrelaciones entre literatura, humanidades y traducción; estudios culturales y traducción; filología y traducción; y recuperación y edición de traducciones antiguas|. Dispone de un buscador.","N/A","0000-00-00","N/A","N/A","N/A","N/A","N/A","N/A","N/A","N/A"
"Portal de Víctimas de la Guerra Civil y Represaliados del Franquismo","no","N/A","http://pares.mcu.es/victimasGCFPortal/staticContent.form?viewName=presentacion","N/A","Base de Datos","Abierto","N/A","Otros","N/A","Español","CEH","Historia","N/A","España ; Guerra Civil, 1936-1939 ; Franquismo ; Historia ; Siglo XX","Ofrece documentación sobre víctimas de la Guerra Civil, el exilio y sus consecuencias y la represión durante la dictadura franquista. Incluye una base de datos con las referencias existentes en archivos dependientes del Ministerio de Educación, Cultura y Deporte (España), sustentada en los documentos que reflejan la violación de los Derechos Humanos de españoles durante dicho periodo. 
“Las referencias del Portal de Víctimas se centran en quienes padecieron expresiones de violencia personal, represión, depuraciones, injusticias y agravios por motivos políticos, ideológicos, religiosos o de otra índole, tanto de los que no eran afines al Movimiento Nacional, como de quienes tampoco lo eran con el gobierno republicano legalmente constituido”.","N/A","2015-12-15","N/A","N/A","N/A","N/A","N/A","N/A","N/A","N/A"
"Principles of War","no","N/A","http://www.clausewitz.com/readings/Principles/index.htm","N/A","Libro electrónico","Abierto","N/A","Otros","N/A","Inglés","CEH","Historia","N/A","Táctica militar ; Estrategia ; Guerra","Texto completo en formato html de la obra |Principles of War| de 1942. Traducido por Hans W. Gatzke.","N/A","2014-11-06","N/A","N/A","N/A","N/A","N/A","N/A","N/A","N/A"
"Problemas del desarrollo : revista latinoamericana de economía","no","N/A","http://www.probdes.iiec.unam.mx/index.html","N/A","Publicación periódica","Abierto","N/A","Otros","2015-00-00","Español","CEE","Economía","N/A","Economía ; América Latina ; Finanzas ; Economía internacional ; Economía agrícola","Revista de economía internacional con enfoques en América Latina editada por el Instituto  de Investigaciones Económicas de la UNAM. Publica artículos sobre teoría económica, modelos matemáticos, desarrollo agrícola, entre otros.","N/A","0000-00-00","N/A","N/A","N/A","N/A","N/A","N/A","N/A","N/A"
"Problemas del Desarrollo: Revista latinoamericana de economía","no","N/A","http://www.revistas.unam.mx/index.php/pde","N/A","Publicación periódica","Abierto","N/A","Universidad Nacional Autónoma de México","2016-12","Español","CEE  , CEDUA","Economía   , Demografía","N/A","Desarrollo económico ; Economía","|Problemas del Desarrollo|, revista trimestral, órgano oficial del Instituto de Investigaciones Económicas de la UNAM, México, recibe todas las interpretaciones teóricas que con rigor científico, pretendan analizar las diferentes dificultades planteadas por el desarrollo económico, a fin de generar crítica, refutación y reconocer desacuerdos entre predicciones como cualquier teoría científica es capaz de hacerlo.","N/A","2016-12-14","N/A","N/A","N/A","N/A","N/A","N/A","N/A","N/A"
"Programa Regional de Formación en Género y Políticas Públicas (PRIGEPP)","no","N/A","http://www.prigepp.org/index.php","N/A","Sitio Web","Abierto","N/A","Otros","N/A","Español","PIEM","Estudios de Género","N/A","Políticas públicas ; Estudios sobre la mujer","El programa se conforma de un grupo de profesionales que buscan articular nuevos conocimientos en el campo de las políticas públicas y programas sociales con los enfoques que esta produciendo la teoría del género.","N/A","0000-00-00","N/A","N/A","N/A","N/A","N/A","N/A","N/A","N/A"
"Programa de Apoyo a Proyectos de Investigación e Innovación Tecnológica","no","N/A","http://dgapa.unam.mx/html/papiit/papit.html","N/A","Sitio Web","Abierto","N/A","Otros","2014-00-00","Español","General","General (todos los centros)","N/A","Investigación ; México ; Apoyos para la investigación","Portal del PAPIIT en el cual se localizan las convocatorias  y requerimientos de apoyo. Tiene la finalidad de apoyar y fomentar el desarrollo de la investigación fundamental y aplicada, la innovación tecnológica y la formación de grupos de investigación en y entre las entidades académicas, a través de proyectos de investigación y de innovación tecnológica, cuyo diseño conduzca a la generación de conocimientos que se publiquen en medios del más alto impacto y calidad, así como a la producción de patentes y transferencia de tecnología. El programa está dirigido a investigadores y profesores de carrera de tiempo completo, así como al personal contratado a través del procedimiento dispuesto en el artículo 51 del Estatuto del Personal Académico que cumplan con los requisitos establecidos en la convocatoria.","N/A","0000-00-00","N/A","N/A","N/A","N/A","N/A","N/A","N/A","N/A"
"Programas de Desarrollo Urbano (Secretaría de Desarrollo Urbano y Vivienda)","no","N/A","http://www.seduvi.df.gob.mx/portal/index.php/programas-de-desarrollo","N/A","Sitio Web","Abierto","N/A","Otros","2015","Español","CEDUA","Estudios Urbanos","N/A","Política urbana ; Planeación de la ciudad ; Desarrollo comunitario urbano","Instrumentos de Planeación y Ordenamiento del Desarrollo Urbano, que en su conjunto determinan la política, estrategia y acciones a implementar en el territorio, de acuerdo con su jerarquía, para la Ciudad de México.","N/A","2015-12-15","N/A","N/A","N/A","N/A","N/A","N/A","N/A","N/A"
"ProQuest Dissertations and Theses","no","N/A","http://search.proquest.com/pqdtft/advanced/dissertations/fromDatabasesLayer?accountid=26837","N/A","Tesis  , Base de Datos","Sólo comunidad Colmex","N/A","Otros","2014-00-00","Inglés","CEE  , CES  , CEI","Economía   , Ciencia Política  , Demografía    , Sociología","N/A","Tesis y disertaciones académicas ; Resúmenes ; Bases de datos","Base de datos que compila tesis de maestría y doctorado de distintas universidades del mundo. Es la colección más completa del mundo en este tipo de fuentes de información. Contiene el archivo de tesis de la Biblioteca del Congreso y la base de datos de registro para la investigación de posgrado. Incluye el texto completo de los documentos y casi 3 millones de referencias de tesis de todo el mundo desde 1743 hasta la actualidad, junto con más de 1 millón de tesis de texto completo que están disponibles para su descarga en formato PDF. Más de 2 millones títulos están disponibles para la compra como copias impresas.","N/A","0000-00-00","N/A","N/A","N/A","N/A","N/A","N/A","N/A","N/A"
"ProQuest Social Sciences Journals","no","N/A","http://search.proquest.com/socscijournals/socialsciences/fromDatabasesLayer?accountid=26837","N/A","Base de Datos","Parcialmente Abierto","N/A","Otros","N/A","Inglés","General","Economía   , Ciencia Política  , Demografía","N/A","N/A","Ofrece acceso de revistas científicas. Comprende más de 1,000 títulos con la mayoría en texto completo.","N/A","0000-00-00","N/A","N/A","N/A","N/A","N/A","N/A","N/A","N/A"
"Proyecto Cervantes","no","N/A","http://cervantes.tamu.edu/V2/index.html","N/A","Sitio Web","Abierto","N/A","Otros","N/A","Español","CELL","Literatura","N/A","Miguel de Cervantes Saavedra ; El Quijote","Comprende la Bibliografía Electrónica Internacional Cervantina, la Biblioteca Digital Cervantina y el Archivo de Imágenes Cervantinas. Incluye bibliografía, imágenes, ediciones de El Quijote, entre otros.","N/A","0000-00-00","N/A","N/A","N/A","N/A","N/A","N/A","N/A","N/A"
"Proyecto para el Estudio Sociolingüístico del Español de España y de América","no","N/A","http://preseea.linguas.net/Corpus.aspx","N/A","Sitio Web","Abierto","N/A","Otros","N/A","Español","CELL","Lingüística","N/A","Español ; Corpus lingüístico","|Es un proyecto para la creación de un corpus de lengua española hablada representiva del mundo hispánico en su variedad geográfica y social. Esos materiales se reúnen atendiendo a la diversidad sociolingüistica de las comunidades de habla hispanohablantes|. Reúne alrededor de 40 equipos de investigación sociolingüística.","N/A","0000-00-00","N/A","N/A","N/A","N/A","N/A","N/A","N/A","N/A"
"Public financial management IMF","no","N/A","http://blog-pfm.imf.org/","N/A","Sitio Web  , Blog","Abierto","N/A","Otros","2014-00-00","Inglés","CEE","Economía","N/A","Economía ; Fondo Monetario internacional ; Finanzas ;  Comercio internacional","Blog especializado en finanzas auspiciado por el FMI en el cual se relatan y comentan notas de importancia para el mercado financiero mundial y también se muestran estadísticas y proyecciones de mercados.","N/A","0000-00-00","N/A","N/A","N/A","N/A","N/A","N/A","N/A","N/A"
