"CIDOB Publicaciones","no","N/A","https://www.cidob.org/publicaciones","N/A","Libro electrónico","Abierto","N/A","Otros","2014","Español  , Inglés","CEDUA  , CEI","Demografía    , Economía   , Relaciones Internacionales","N/A","Desarrollo regional ; Relaciones culturales ; Seguridad internacional ; Emigración e inmigración ; América Latina","CIDOB edita varias publicaciones periódicas y libros sobre temas relacionados con sus líneas prioritarias de trabajo (Desarrollo regional, Dinámicas interculturales, Europa, Seguridad, Migraciones, Asia, América Latina, Mediterráneo y Oriente Medio) en el marco de las relaciones internacionales.","N/A","2015-11-12","N/A","N/A","N/A","N/A","N/A","N/A","N/A","N/A"
"Cities","si","N/A","N/A","N/A","N/A","Sólo comunidad Colmex","N/A","Otros","N/A","N/A","N/A","N/A","N/A","Urbanismo ; Urbanización ; Política urbana; Revistas","Disponible en formato impreso: 1983-2010 (con algunos faltantes)","N/A","0000-00-00","N/A","N/A","N/A","N/A","N/A","N/A","N/A","N/A"
"Clarisel: Base de datos bibliográficas","no","N/A","http://155.210.12.154/clarisel/index.htm","N/A","Base de Datos","Abierto","N/A","Otros","","Español","CELL","Literatura","N/A","Literatura medieval ; literatura aragonesa ;","Incluye las siguientes bases de datos: literatura caballeresca hispánica, cuento medieval hispánico y literatura aragonesa. Recoge resúmenes de artículos, libros y reseñas.","N/A","0000-00-00","N/A","N/A","N/A","N/A","N/A","N/A","N/A","N/A"
"CLASE. Citas Latinoamericanas en Ciencias Sociales y Humanidades","ambos","N/A","http://132.248.9.1:8991/F/-/?func=find-b-0&local_base=CLA01","N/A","Base de Datos","Abierto","N/A","Otros","N/A","Inglés  , Francés  , Español","CELL","Literatura","N/A","Ciencias sociales ; Humanidades ; Índices ; Bases de datos ; Revistas ; América Latina ; Área del Caribe","Base de datos bibliográfica que ofrece alrededor de 350 mil registros bibliográficos de documentos publicados en cerca de 1500 revistas especializadas en ciencias sociales y humanidades publicadas en América Latina y el Caribe.

Disponible en formato impreso: 1975-1997.","N/A","0000-00-00","N/A","N/A","N/A","N/A","N/A","N/A","N/A","N/A"
"Classiques des sciences sociales, Les.","no","N/A","http://classiques.uqac.ca/","N/A","Sitio Web","Abierto","N/A","Otros","","Francés","CES","Sociología","N/A","Antropología ; Sociología","Ofrece libros en texto completo de sociología, antropología y libros de la teoría social en forma gratuita. Las obras están disponibles en francés. El sitio fue creado por la Universidad de Quebec. Las obras disponibles incluyen teóricos sociales (Comte, Descartes, Hobbes, Spencer, Engels, Marx, Freud, Lukács); sociólogos y antropólogos (Durkheim, Malinowski, Evans-Pritchard, Mead, Mauss).","N/A","0000-00-00","N/A","N/A","N/A","N/A","N/A","N/A","N/A","N/A"
"CODATU : Library","no","N/A","http://www.codatu.org/library/","N/A","Libro electrónico","Abierto","N/A","Otros","2015","Francés  , Inglés","CEDUA","Estudios Urbanos   , Medio Ambiente","N/A","Transporte urbano ; Política urbana ; Urbanismo ; Países en desarrollo","|Cooperation for urban mobility in the developing world (CODATU) was created in 1980 following a seminal international conference on urban transport in Dakar, Senegal. CODATU is an international non-profitmaking organization whose aim is to promote international exchanges between the various players in the transport and urban mobility sector: public authorities, companies, and urban transport research institutes and professionals|","N/A","2015-12-15","N/A","N/A","N/A","N/A","N/A","N/A","N/A","N/A"
"Cognitive Linguistics","ambos","N/A","http://ejournals.ebsco.com/Journal2.asp?JournalID=102409","N/A","N/A","Sólo comunidad Colmex","N/A","Otros","N/A","N/A","N/A","N/A","N/A","Lingüística ; Gramática cognoscitiva ; Revistas","Disponible en formato impreso: 1990-2011.","N/A","0000-00-00","N/A","N/A","N/A","N/A","N/A","N/A","N/A","N/A"
"Colección Digital UANL","no","N/A","http://cd.dgb.uanl.mx/","N/A","Sitio Web  , Base de Datos","Abierto","N/A","Otros","2010-00-00","Español  , Francés  , Italiano","BIBLIOTECA  , CEAA  , CEDUA  , CEE  , CEH  , CEI  , CELL  , CES  , General","Artes  , Administración Pública  , Bibliotecología  , Ciencia Política  , Demografía    , Economía   , Estudios de Género  , Estudios Urbanos   , Filosofía  , General (todos los centros)  , Historia  , Lingüística  , Literatura  , Medio Ambiente  , Relaciones Internacionales  , Religión  , Sociología","N/A","Bibliotecas digitales ; Memoria del mundo ; Acervos digitales internacionales","La Colección Digital de la UANL está conformada por documentos editados durante los siglos XVI al XIX, en español, italiano, francés y latín, así como por las tesis de postgrado (Maestría, Especialidad y Doctorado) generadas en la UANL y por otros documentos de interés para la investigación. Los documentos de esta colección forman parte de los acervos bibliográficos que poseen la Biblioteca Universitaria Raúl Rangel Frías, Capilla Alfonsina Biblioteca Universitaria, Centro Regional de Información y Documentación en Salud de la Facultad de Medicina y Biblioteca José Juan Vallejo de la Facultad de Derecho y Criminología.","N/A","0000-00-00","N/A","N/A","N/A","N/A","N/A","N/A","N/A","N/A"
"Colecciones Digitales del Instituto Ibero-Americano","no","N/A","http://digital.iai.spk-berlin.de/viewer/","N/A","Base de Datos  , Sitio Web","Abierto","N/A","Otros","N/A","Alemán  , Español  , Inglés","CEH","Historia","N/A","América Latina ; Bases de datos ; Bibliotecas digitales","Ofrece una selección de las obras y documentos de las colecciones del Instituto en texto completo. Incluye carteles, fotografías, libros, manuscritos, mapas, revistas y periódicos. Ofrece una herramienta de búsqueda e índices por autor, título y signatura.","N/A","2015-12-15","N/A","N/A","N/A","N/A","N/A","N/A","N/A","N/A"
"Colecciones mexicanas","no","N/A","http://www.coleccionesmexicanas.unam.mx/","N/A","Sitio Web","Abierto","N/A","Otros","2010-00-00","Español","CEH","Historia","N/A","Archivos ; Fondos antiguos ; Colecciones especiales","Colecciones Mexicanas es un proyecto que nace con la finalidad de difundir y preservar acervos documentales, fotográficos, videográficos, bibliográficos y hemerográficos sobre la historia de México. Buscamos que las colecciones aquí incluidas sean de relevancia para estudiantes, académicos, investigadores o cualquier interesado en conocer y ampliar su cultura sobre la historia de México.

Las primeras colecciones seleccionadas son: El Archivo Franciscano del Fondo Reservado de la Biblioteca Nacional; Revistas Literarias del siglo XIX, con dos títulos del acervo de la biblioteca del Instituto Mora y con la investigación de la Facultad de Filosofía y Letras de la UNAM, y Españoles en México en el siglo XIX, proyecto de investigación del Instituto de Investigaciones Bibliográficas de la UNAM, que da inicio con una selección de cartas dirigidas a Enrique de Olavarría y Ferrari.","N/A","0000-00-00","N/A","N/A","N/A","N/A","N/A","N/A","N/A","N/A"
"Collective Behavior and Social Movements Section of the American Sociological Association","no","N/A","http://cbsm-asa.org/","N/A","Sitio Web","Abierto","N/A","Otros","N/A","Inglés","CES","Sociología","N/A","Movimientos sociales","La sección |fué creada en 1980 para fomentar el estudio de las formas emergentes y el comportamiento social y extra-institucionales, en particular las multitudes y los movimientos sociales.|","N/A","0000-00-00","N/A","N/A","N/A","N/A","N/A","N/A","N/A","N/A"
"Comisión Económica para América Latina y El Caribe (CEPAL). Publicaciones","no","N/A","http://www.eclac.org/publicaciones/","N/A","Base de Datos  , Libro electrónico","Abierto","N/A","Otros","2013","Español","CEE  , CEDUA","Economía   , Demografía","N/A","América Latina ; Área del Caribe ; Economía ; Estadísticas","Incluye libros, informes anuales, Cuadernos de la CEPAL, coediciones, series, Revista CEPAL, boletines, entre otros.","N/A","0000-00-00","N/A","N/A","N/A","N/A","N/A","N/A","N/A","N/A"
"Comisión Económica para América Latina y el Caribe. Repositorio Digital","no","N/A","http://repositorio.cepal.org/?locale-attribute=es","N/A","Libro electrónico  , Publicación periódica","Abierto","N/A","Otros","N/A","Español","CES","Sociología  , Estudios de Género","N/A","América Latina; situación social","El repositorio permite capturar, almacenar, indexar, preservar y redistribuir -en formato digital- la producción intelectual de la organización.","N/A","0000-00-00","N/A","N/A","N/A","N/A","N/A","N/A","N/A","N/A"
"Comisión para la Cooperación Laboral","no","N/A","http://sp.naalc.org/publications_es.htm","N/A","Sitio Web","Abierto","N/A","Otros","N/A","Inglés","CEDUA","Demografía","N/A","Trabajo ; Mercado laboral ; Trabajadores ; Derechos humanos ; Tratado de Libre Comercio de América del Norte ; Derecho laboral internacional","Recursos de información sobre Trabajo y Trabajadores; Derechos humanos; NAFTA; Derecho laboral internacional .","N/A","2016-12-14","N/A","N/A","N/A","N/A","N/A","N/A","N/A","N/A"
"Comité 1540","no","N/A","http://http://www.un.org/es/sc/1540/","N/A","Sitio Web","Abierto","N/A","Otros","N/A","Inglés  , Francés  , Español","CEI","Relaciones Internacionales  , Ciencia Política  , Administración Pública","N/A","Naciones Unidas. Consejo de Seguridad ; Seguridad internacional ; Bases de datos","Sitio que contiene recursos y documentos del Consejo de Seguridad de las Naciones Unidas sobre proliferación de armas nucleares, químicas y biológicas. El sitio contiene las resoluciones en esta materia, declaraciones de los presidentes e informes.","N/A","2014-10-20","N/A","N/A","N/A","N/A","N/A","N/A","N/A","N/A"
"Comité Mexicano de Ciencias Históricas","no","N/A","http://www.mora.edu.mx/cmch/SitePages/Inicio.aspx","N/A","Sitio Web","Abierto","N/A","Otros","","Español","CEH","Historia","N/A","México ; Historia ; Asociaciones de profesionales","El Comité se integró el 24 de Noviembre de 1966 y agrupa a profesionales de la historia en México. Incluye datos de sus publicaciones, noticias, datos de instituciones mexicanas dedicadas a la historia y acceso a su Boletín mensual con información de interés para historiadores.","N/A","0000-00-00","N/A","N/A","N/A","N/A","N/A","N/A","N/A","N/A"
"Communications of the IBIMA","no","N/A","http://www.ibimapublishing.com/journals/CIBIMA/cibima.html","N/A","Publicación periódica","Abierto","N/A","Otros","2015-00-00","Inglés","CEE","Economía","N/A","Economía ; Publicaciones periódicas ; Comercio internacional ; Negocios","Publicación arbitrada de la International Business Information Management Association (IBIMA) dedicada a promover y diseminar información sobre economía y negocios . Con sede en Estados Unidos estudian también procesos de emprendedurismo y sus relaciones con los mercados.","N/A","0000-00-00","N/A","N/A","N/A","N/A","N/A","N/A","N/A","N/A"
"Community care","ambos","N/A","http://search.ebscohost.com/login.aspx?direct=true&db=a9h&jid=IHN〈=es&site=ehost-live","N/A","Publicación periódica","Sólo comunidad Colmex","N/A","Otros","","Inglés","CES","Sociología","N/A","Asistencia social ; Asistencia pública ; Salud pública","Disponible en formato impreso: 1998-2011 (con algunos faltantes)","N/A","0000-00-00","N/A","N/A","N/A","N/A","N/A","N/A","N/A","N/A"
"Comparative education review","ambos","N/A","http://ejournals.ebsco.com/Journal2.asp?JournalID=106546","N/A","Publicación periódica","Sólo comunidad Colmex","N/A","Otros","","Inglés","CES","Sociología","N/A","Educación ; Revistas","Disponible en formato impreso: 1989-2011 (con algunos faltantes) En: JStor (1957 – 2014).","N/A","0000-00-00","N/A","N/A","N/A","N/A","N/A","N/A","N/A","N/A"
"Comparative Literature","ambos","N/A","http://eds.a.ebscohost.com/ehost/detail?sid=292163df-fdfc-415e-a882-1b72c8e2387e%40sessionmgr4002&vid=1&hid=4213&bdata=Jmxhbmc9ZXMmc2l0ZT1laG9zdC1saXZlJnNjb3BlPXNpdGU%3d#db=a9h&jid=CLT","N/A","N/A","Sólo comunidad Colmex","N/A","Otros","","N/A","N/A","N/A","N/A","Literatura comparada ; Revistas","Disponible en formato impreso: 1949-2011","N/A","0000-00-00","N/A","N/A","N/A","N/A","N/A","N/A","N/A","N/A"
"Comparative sociology","ambos","N/A","http://ejournals.ebsco.com/Journal2.asp?JournalID=108919","N/A","Publicación periódica","Sólo comunidad Colmex","N/A","Otros","","Inglés","CES","Sociología","N/A","Sociología ; Cambio social","Disponible en formato impreso: 2002-2006. En: Electronic Journal Service de 2002 a la fecha.","N/A","0000-00-00","N/A","N/A","N/A","N/A","N/A","N/A","N/A","N/A"
"Comparative Studies in Society and History","ambos","N/A","http://journals.cambridge.org/action/displayJournal?jid=CSS","N/A","N/A","Sólo comunidad Colmex","N/A","Otros","","N/A","N/A","N/A","N/A","Ciencias sociales ; Historia ; Ciencia política ; Revistas","Disponible en formato impreso: 1958-2011","N/A","0000-00-00","N/A","N/A","N/A","N/A","N/A","N/A","N/A","N/A"
"Compludoc  base de datos de artículos de revistas","no","N/A","http://europa.sim.ucm.es/compludoc/","N/A","Base de Datos","Abierto","N/A","Otros","2012-02","Inglés  , Español","BIBLIOTECA  , CEAA  , CEDUA  , CEE  , CEH  , CEI  , CELL  , CES  , General","Administración Pública  , Bibliotecología  , Ciencia Política  , Demografía    , Economía   , Estudios de Género  , Estudios Urbanos   , General (todos los centros)  , Historia  , Lingüística  , Literatura  , Medio Ambiente  , Relaciones Internacionales  , Religión  , Sociología","N/A","Ciencia ; Ciencias sociales ; Biomedicina ; Humanidades ; Revistas ; Índices","Desde el mes de marzo de 2012 Compludoc ha dejado de incorporar nuevas referencias y ya no emitirá más mensajes sobre novedades a sus usuarios registrados. 
La base de datos seguirá estando disponible para su consulta indefinidamente o hasta que quede debidamente integrada en la base Dialnet.","N/A","0000-00-00","N/A","N/A","N/A","N/A","N/A","N/A","N/A","N/A"
"Compton Foundation, Inc.","no","N/A","http://www.comptonfoundation.org","N/A","Base de Datos","Abierto","N/A","Otros","N/A","Inglés","General","General (todos los centros)","N/A","N/A","N/A","N/A","0000-00-00","N/A","N/A","N/A","N/A","N/A","N/A","N/A","N/A"
"Conferencia de las Naciones Unidas sobre Comercio y Desarrollo","no","N/A","http://unctad.org/es/paginas/Publications/Series.aspx","N/A","Base de Datos","Abierto","N/A","Otros","2015-00-00","Español  , Inglés","CEE","Economía","N/A","Naciones Unidas ; Conferencia de las Naciones Unidas sobre Comercio y Desarrollo ;","Portal de la Conferencia de las Naciones Unidas sobre Comercio y Desarrollo que compila recursos de información sobre el desarrollo económico y comercio internacional. Entre los documentos que se encuentran en este portal es posible localizar documentos de trabajo, libros electrónicos y resúmenes técnicos sobre los temas que preocupan a la Conferencia.","N/A","0000-00-00","N/A","N/A","N/A","N/A","N/A","N/A","N/A","N/A"
"Conferencias Panamericanas (1889-1938)","no","si","http://acervo.sre.gob.mx/index.php?option=com_content&view=article&id=63&Itemid=341","N/A","Base de Datos","Abierto","N/A","Otros","","Español","CEI","Ciencia Política  , Relaciones Internacionales","N/A","Conferencias panamericanas","Base de datos (http://biblio-codex.colmex.mx/F/-/?func=find-b-0&local_base=COP01) y libros digitales (http://biblio2.colmex.mx/coinam/Default.htm) relativos a las Conferencias Panamericanas efectuadas en el periodo de 1889-1938, que resguarda el Acervo Histórico Diplomático de la Secretaría de Relaciones Exteriores.  Contiene un buscador que permite identificar actores y documentos fundamentales de la investigación histórica y diplomática sobre México y el resto de América Latina.","N/A","0000-00-00","N/A","N/A","N/A","N/A","N/A","N/A","N/A","N/A"
"Consejo Latinoamericano de Ciencias Sociales","no","N/A","http://www.clacso.org","N/A","Sitio Web","Abierto","N/A","Otros","N/A","Español","General","General (todos los centros)","N/A","Financiamiento","N/A","N/A","0000-00-00","N/A","N/A","N/A","N/A","N/A","N/A","N/A","N/A"
"Consejo Mexicano de Asuntos Internacionales","no","N/A","http://www.consejomexicano.org/es/?comexi","N/A","Sitio Web","Abierto","N/A","Otros","2014","Español","CEI","Relaciones Internacionales","N/A","México ; Relaciones internacionales","El Consejo Mexicano de Asuntos Internacionales (COMEXI) es el primer y hasta ahora único foro plural y multidisciplinario abocado al debate y análisis sobre el papel de México en el mundo y la creciente influencia de los acontecimientos internacionales en el quehacer nacional. Contiene además el texto completo de sus publicaciones, así como a estudios comparativos en relación con asuntos internacionales.","N/A","2014-10-21","N/A","N/A","N/A","N/A","N/A","N/A","N/A","N/A"
"Consejo Nacional de Ciencia y Tecnología .(CONACYT)","no","N/A","http://www.conacyt.mx","N/A","Base de Datos","Abierto","N/A","Otros","N/A","Español","General","General (todos los centros)","N/A","N/A","N/A","N/A","0000-00-00","N/A","N/A","N/A","N/A","N/A","N/A","N/A","N/A"
"Consejo Nacional de Evaluación de la Política de Desarrollo Social (CONEVAL)","no","N/A","http://web.coneval.gob.mx/Paginas/principal.aspx","N/A","Sitio Web","Abierto","N/A","Otros","","Español","CEE","Economía   , Administración Pública","N/A","México ; Pobreza ; Política social ; Desarrollo social","Incluye información generada por el CONEVAL relacionada la política social y la medición de la pobreza en México.","N/A","0000-00-00","N/A","N/A","N/A","N/A","N/A","N/A","N/A","N/A"
"Consejo Nacional de Población (CONAPO). Indicadores","no","N/A","http://www.conapo.gob.mx/en/CONAPO/Indicadores","N/A","N/A","Abierto","N/A","Otros","","N/A","N/A","N/A","N/A","Población ; México ; Estadísticas ; Economía","N/A","N/A","0000-00-00","N/A","N/A","N/A","N/A","N/A","N/A","N/A","N/A"
"Contemporary economics","no","N/A","http://we.vizja.pl/en/home","N/A","Publicación periódica","Abierto","N/A","Otros","2015-00-00","Inglés","CEE","Economía","N/A","Economía ; Finanzas ; Comercio ; Banca","Revista publicada por la University of Finance and Management, en Varsovia, sobre temas relacionados a las finanzas, la banca internacional, población, ciencias sociales y administración. Promueve  la formación universitario de nuevos economistas y promueve el uso de metodologías diversas en la investigación económica.","N/A","0000-00-00","N/A","N/A","N/A","N/A","N/A","N/A","N/A","N/A"
"Contemporary Politics","ambos","N/A","http://ejournals.ebsco.com/journal2.asp?journalid=104561","N/A","N/A","Sólo comunidad Colmex","N/A","Otros","","N/A","N/A","N/A","N/A","Política mundial ; Revistas","Disponible en formato impreso: 1998-2011","N/A","0000-00-00","N/A","N/A","N/A","N/A","N/A","N/A","N/A","N/A"
"Contratexto. Revista digital de la Facultad de Comunicación. Universidad de Lima","no","N/A","http://www3.ulima.edu.pe/Revistas/contratexto/index.html","N/A","Publicación periódica","Abierto","N/A","Otros","N/A","Español","CES","Sociología","N/A","Comunicación ; cultura ; América Latina","Revista publicada por la Universidad de Lima que aborda temas como cultura, educación y comunicación.","N/A","0000-00-00","N/A","N/A","N/A","N/A","N/A","N/A","N/A","N/A"
"Contribuciones a la economía","no","N/A","http://www.eumed.net/ce/index.html","N/A","Publicación periódica","Abierto","N/A","Otros","2015-00-00","Español","CEE","Economía","N/A","Economía ; Economía agrícola ; Economía internacional","Revista académica editada por la firma Eumed, en la que se encuentran artículos de economía agrícola, internacional y finanzas.","N/A","0000-00-00","N/A","N/A","N/A","N/A","N/A","N/A","N/A","N/A"
"Core documents of our democracy","no","N/A","http://www.gpo.gov/libraries/core_docs.htm","N/A","Sitio Web","Abierto","N/A","Otros","N/A","Inglés","CEI","Ciencia Política","N/A","Estados Unidos -- Política y gobierno; Estados Unidos -- Constitución; Estados Unidos -- Historia; Estados Unidos -- Condiciones económicas; Características nacionales norteamericanas","|This collection provides American citizens with direct online access to the basic Federal Government documents that define our democratic society. These titles contain information about the democratic process that are critical to informed citizens. They support the public's right to know about the essential activities of their Government.|","N/A","2015-10-06","N/A","N/A","N/A","N/A","N/A","N/A","N/A","N/A"
"Corea del Sur - The Economist Intelligence Unit","no","N/A","http://viewswire.eiu.com/index.asp?layout=VWCountryVW3&region_id=&country_id=1590000159","N/A","Base de Datos  , Sitio Web","Sólo comunidad Colmex","N/A","Otros","2014","Inglés","CEAA","Economía","N/A","Corea (Sur) -- Condiciones económicas","Apartado que reúne información sobre política, economía, finanzas, negocios, regulaciones, estadísticas y noticias de interés sobre Corea del Sur. Contine información geográfica del país.","N/A","2014-10-16","N/A","N/A","N/A","N/A","N/A","N/A","N/A","N/A"
"Corporación Latinobarómetro","no","N/A","http://www.latinobarometro.org/lat.jsp","N/A","Sitio Web","Abierto","N/A","Otros","2015-00-00","Español","CEI","Relaciones Internacionales  , Administración Pública","N/A","Estudios de opinión publica - América Latina","|Latinobarómetro es un estudio de opinión pública que aplica anualmente alrededor de 20.000 entrevistas en 18 países de América Latina representando a más de 600 millones de habitantes.
Corporación Latinobarómetro es una ONG sin fines de lucro con sede en Santiago de Chile, única responsable de la producción y publicación de los datos|.","N/A","2015-05-19","N/A","N/A","N/A","N/A","N/A","N/A","N/A","N/A"
"Corpus de Referencia del Español Actual","no","N/A","http://corpus.rae.es/creanet.html","N/A","Base de Datos","Abierto","N/A","Real Academia Española","N/A","Español","CELL","Lingüística","N/A","Corpus lingüístico ; Español","|es un conjunto de textos de diversa procedencia, almacenados en soporte informático, del que es posible extraer información para estudiar las palabras, sus significados y sus contextos|.","N/A","0000-00-00","N/A","N/A","N/A","N/A","N/A","N/A","N/A","N/A"
"Corpus del Español","no","N/A","http://www.corpusdelespanol.org/","N/A","Base de Datos","Abierto","N/A","Otros","N/A","Español","CELL","Lingüística","N/A","Corpus lingüístico ; Español","Permite hacer búsquedas de más de 100,000.000 palabras de los siglos XVIII al XX. Es posible buscar por: palabras exactas, etiquetas, lemas, categoría gramatical, colocaciones. Además, posibilita búsquedas por frecuencia de uso, búsquedas basadas en la semántica. El corpus es compilado por Mark Davies de la Universidad de Brigham Young.","N/A","0000-00-00","N/A","N/A","N/A","N/A","N/A","N/A","N/A","N/A"
"Corpus del Español Mexicano Contemporáneo","no","N/A","http://cemc.colmex.mx/","N/A","Video digital","Abierto","N/A","El Colegio de México","","Español","CELL","Lingüística","N/A","Corpus lingüístico ; Español","Dispone de |una colección de contextos de uso de las palabras, que sirvieran como base a la elaboración del Diccionario del español de México, y tenía por objetivo deslindar y reconocer las características del español mexicano contemporáneo, sobre todo en cuanto a su léxico|.","N/A","0000-00-00","N/A","N/A","N/A","N/A","N/A","N/A","N/A","N/A"
"Corpus Diacrónico y Diatópico del Español de América","no","N/A","http://www.cordiam.org/","N/A","Sitio Web","Abierto","N/A","Academia Mexicana de la Lengua","N/A","Español","CELL","Lingüística","N/A","Corpus ;  Español","El recurso |fue concebido con el objetivo de enriquecer el conocimiento de la gramática histórica general del español y de la historia general de esta lengua. Está constituido por documentos escritos en español y en América exclusivamente. Abarca los actuales 19 países americanos hispanohablantes más el sur y oeste de Estados Unidos, Jamaica, Haití y Guyana (antiguos territorios de la corona española)|. Permite buscar por: metadatos, siglos, países, tipo textual, autor y datos étnicos.","N/A","0000-00-00","N/A","N/A","N/A","N/A","N/A","N/A","N/A","N/A"
"Corpus Digital Giennense","no","N/A","http://www.corpusdigitalgiennense.es/","N/A","Sitio Web","Abierto","N/A","Otros","N/A","Español","CELL","Literatura","N/A","Corpus ; Romances ; Canciones ; Leyendas","|tiene como objetivo difundir las manifestaciones literarias de tradición oral registradas en la provincia de Jaén|. Se divide en tres apartados: romances, canciones, cuentos y leyendas. Es posible buscar bajo: referencia, informante, localidad del informante y subcategoria.","N/A","0000-00-00","N/A","N/A","N/A","N/A","N/A","N/A","N/A","N/A"
"Corpus Excale de Escritura","no","N/A","http://www.inee.edu.mx/index.php/proyectos/excale/corpus-excale","N/A","Base de Datos","Abierto","N/A","Otros","2011-02-04","Español","CELL","Lingüística","N/A","Corpus lingüístico ; Español","Elaborado por el Instituto Nacional para la Evaluación de la Educación [INEE, México]. Contiene un |conjunto de textos producidos por estudiantes de tercero y sexto de primaria, así como de tercero de secundaria, que asisten a las escuelas representativas de los diferentes tipos de servicio educativo en todo el país... permite consultar las producciones textuales de acuerdo con variables demográficas y socioculturales asociadas a las condiciones en que viven y aprenden los estudiantes|.","N/A","0000-00-00","N/A","N/A","N/A","N/A","N/A","N/A","N/A","N/A"
